<?xml version="1.0"?>
<!DOCTYPE liferay-resource-actions PUBLIC "-//Liferay//DTD Resource Actions 6.1.0//EN" "http://www.liferay.com/dtd/liferay-resource-actions_6_1_0.dtd">

<resource-action-mapping>
	<portlet-resource>
		<portlet-name>102</portlet-name>
		<permissions>
			<supports>
				<action-key>VIEW</action-key>
				<action-key>ADD_TO_PAGE</action-key>
				<action-key>CONFIGURATION</action-key>
			</supports>
			<community-defaults>
				<action-key>VIEW</action-key>
			</community-defaults>
			<guest-defaults>
				<action-key>VIEW</action-key>
			</guest-defaults>
			<guest-unsupported>
				<action-key>ADD_TO_PAGE</action-key>
				<action-key>CONFIGURATION</action-key>
			</guest-unsupported>
			<layout-manager>
				<action-key>VIEW</action-key>
			</layout-manager>
		</permissions>
	</portlet-resource>
</resource-action-mapping>